tcpdump -n -i eth0
tcpdump: verbose output suppressed, use -v[v]... for full protocol decode
listening on eth0, link-type EN10MB (Ethernet), snapshot length 262144 bytes
21:20:12.461878 IP 143.110.213.189.22 > 70.24.37.40.58657: Flags [P.], seq 1035984960:1035985148, ack 3266279149, win 513, length 188
21:20:12.466936 IP 70.24.37.40.58657 > 143.110.213.189.22: Flags [.], ack 188, win 250, length 0
21:20:12.478052 IP 70.24.37.40.58657 > 143.110.213.189.22: Flags [P.], seq 1:37, ack 188, win 250, length 36
21:20:12.478181 IP 143.110.213.189.22 > 70.24.37.40.58657: Flags [P.], seq 188:224, ack 37, win 513, length 36
21:20:12.509950 IP 70.24.37.40.58657 > 143.110.213.189.22: Flags [P.], seq 37:73, ack 224, win 250, length 36
21:20:12.510268 IP 143.110.213.189.22 > 70.24.37.40.58657: Flags [P.], seq 224:260, ack 73, win 513, length 36
21:20:12.541849 IP 70.24.37.40.58657 > 143.110.213.189.22: Flags [P.], seq 73:109, ack 260, win 250, length 36
21:20:12.542022 IP 143.110.213.189.22 > 70.24.37.40.58657: Flags [P.], seq 260:296, ack 109, win 513, length 36
21:20:12.557060 IP 143.110.213.189.22 > 70.24.37.40.58657: Flags [P.], seq 296:1236, ack 109, win 513, length 940
21:20:12.562256 IP 70.24.37.40.58657 > 143.110.213.189.22: Flags [.], ack 1236, win 255, length 0
21:20:12.572851 IP 70.24.37.40.58657 > 143.110.213.189.22: Flags [P.], seq 109:145, ack 1236, win 255, length 36
21:20:12.573042 IP 143.110.213.189.22 > 70.24.37.40.58657: Flags [P.], seq 1236:1272, ack 145, win 513, length 36
21:20:12.604730 IP 70.24.37.40.58657 > 143.110.213.189.22: Flags [P.], seq 145:181, ack 1272, win 255, length 36
21:20:12.604891 IP 143.110.213.189.22 > 70.24.37.40.58657: Flags [P.], seq 1272:1308, ack 181, win 513, length 36
21:20:12.638468 IP 70.24.37.40.58657 > 143.110.213.189.22: Flags [P.], seq 181:217, ack 1308, win 255, length 36
21:20:12.638652 IP 143.110.213.189.22 > 70.24.37.40.58657: Flags [P.], seq 1308:1344, ack 217, win 513, length 36
21:20:12.660886 IP 143.110.213.189.22 > 70.24.37.40.58657: Flags [P.], seq 1344:1500, ack 217, win 513, length 156
21:20:12.661110 IP 143.110.213.189.22 > 70.24.37.40.58657: Flags [P.], seq 1500:2320, ack 217, win 513, length 820
21:20:12.666672 IP 70.24.37.40.58657 > 143.110.213.189.22: Flags [.], ack 2320, win 251, length 0
21:20:12.684716 IP 70.24.37.40.58657 > 143.110.213.189.22: Flags [P.], seq 217:253, ack 2320, win 251, length 36
21:20:12.684900 IP 143.110.213.189.22 > 70.24.37.40.58657: Flags [P.], seq 2320:2356, ack 253, win 513, length 36
21:20:12.732202 IP 70.24.37.40.58657 > 143.110.213.189.22: Flags [.], ack 2356, win 251, length 0
21:20:12.732202 IP 70.24.37.40.58657 > 143.110.213.189.22: Flags [P.], seq 253:289, ack 2356, win 251, length 36
21:20:12.732369 IP 143.110.213.189.22 > 70.24.37.40.58657: Flags [P.], seq 2356:2392, ack 289, win 513, length 36
21:20:12.762825 IP 70.24.37.40.58657 > 143.110.213.189.22: Flags [P.], seq 289:325, ack 2392, win 251, length 36
21:20:12.762996 IP 143.110.213.189.22 > 70.24.37.40.58657: Flags [P.], seq 2392:2428, ack 325, win 513, length 36
21:20:12.764870 IP 143.110.213.189.22 > 70.24.37.40.58657: Flags [P.], seq 2428:3584, ack 325, win 513, length 1156
21:20:12.769551 IP 70.24.37.40.58657 > 143.110.213.189.22: Flags [.], ack 3584, win 255, length 0
21:20:12.795146 IP 70.24.37.40.58657 > 143.110.213.189.22: Flags [P.], seq 325:361, ack 3584, win 255, length 36
21:20:12.795313 IP 143.110.213.189.22 > 70.24.37.40.58657: Flags [P.], seq 3584:3620, ack 361, win 513, length 36
21:20:12.827080 IP 70.24.37.40.58657 > 143.110.213.189.22: Flags [P.], seq 361:397, ack 3620, win 255, length 36
21:20:12.827284 IP 143.110.213.189.22 > 70.24.37.40.58657: Flags [P.], seq 3620:3656, ack 397, win 513, length 36
21:20:12.858834 IP 70.24.37.40.58657 > 143.110.213.189.22: Flags [P.], seq 397:433, ack 3656, win 255, length 36
21:20:12.859003 IP 143.110.213.189.22 > 70.24.37.40.58657: Flags [P.], seq 3656:3692, ack 433, win 513, length 36
21:20:12.869129 IP 143.110.213.189.22 > 70.24.37.40.58657: Flags [P.], seq 3692:4632, ack 433, win 513, length 940
21:20:12.875964 IP 70.24.37.40.58657 > 143.110.213.189.22: Flags [.], ack 4632, win 251, length 0
21:20:12.890747 IP 70.24.37.40.58657 > 143.110.213.189.22: Flags [P.], seq 433:469, ack 4632, win 251, length 36
21:20:12.890948 IP 143.110.213.189.22 > 70.24.37.40.58657: Flags [P.], seq 4632:4668, ack 469, win 513, length 36
21:20:12.922211 IP 70.24.37.40.58657 > 143.110.213.189.22: Flags [P.], seq 469:505, ack 4668, win 251, length 36
21:20:12.922396 IP 143.110.213.189.22 > 70.24.37.40.58657: Flags [P.], seq 4668:4704, ack 505, win 513, length 36
21:20:12.953895 IP 70.24.37.40.58657 > 143.110.213.189.22: Flags [P.], seq 505:541, ack 4704, win 251, length 36
21:20:12.954058 IP 143.110.213.189.22 > 70.24.37.40.58657: Flags [P.], seq 4704:4740, ack 541, win 513, length 36
21:20:12.972965 IP 143.110.213.189.22 > 70.24.37.40.58657: Flags [P.], seq 4740:5680, ack 541, win 513, length 940
21:20:12.978341 IP 70.24.37.40.58657 > 143.110.213.189.22: Flags [.], ack 5680, win 255, length 0
21:20:12.986463 IP 70.24.37.40.58657 > 143.110.213.189.22: Flags [P.], seq 541:577, ack 5680, win 255, length 36
21:20:12.986633 IP 143.110.213.189.22 > 70.24.37.40.58657: Flags [P.], seq 5680:5716, ack 577, win 513, length 36
21:20:13.017333 IP 70.24.37.40.58657 > 143.110.213.189.22: Flags [P.], seq 577:613, ack 5716, win 255, length 36
21:20:13.017532 IP 143.110.213.189.22 > 70.24.37.40.58657: Flags [P.], seq 5716:5752, ack 613, win 513, length 36
21:20:13.056331 IP 70.24.37.40.58657 > 143.110.213.189.22: Flags [P.], seq 613:649, ack 5752, win 255, length 36
21:20:13.056760 IP 143.110.213.189.22 > 70.24.37.40.58657: Flags [P.], seq 5752:5788, ack 649, win 513, length 36
21:20:13.077080 IP 143.110.213.189.22 > 70.24.37.40.58657: Flags [P.], seq 5788:6728, ack 649, win 513, length 940
21:20:13.082908 IP 70.24.37.40.58657 > 143.110.213.189.22: Flags [.], ack 6728, win 251, length 0
21:20:13.082908 IP 70.24.37.40.58657 > 143.110.213.189.22: Flags [P.], seq 649:685, ack 6728, win 251, length 36
21:20:13.083213 IP 143.110.213.189.22 > 70.24.37.40.58657: Flags [P.], seq 6728:6764, ack 685, win 513, length 36
21:20:13.112633 IP 70.24.37.40.58657 > 143.110.213.189.22: Flags [P.], seq 685:721, ack 6764, win 251, length 36
21:20:13.112878 IP 143.110.213.189.22 > 70.24.37.40.58657: Flags [P.], seq 6764:6800, ack 721, win 513, length 36
21:20:13.144725 IP 70.24.37.40.58657 > 143.110.213.189.22: Flags [P.], seq 721:757, ack 6800, win 251, length 36
21:20:13.144934 IP 143.110.213.189.22 > 70.24.37.40.58657: Flags [P.], seq 6800:6836, ack 757, win 513, length 36
21:20:13.176560 IP 70.24.37.40.58657 > 143.110.213.189.22: Flags [P.], seq 757:793, ack 6836, win 251, length 36
21:20:13.176766 IP 143.110.213.189.22 > 70.24.37.40.58657: Flags [P.], seq 6836:6872, ack 793, win 513, length 36
21:20:13.180945 IP 143.110.213.189.22 > 70.24.37.40.58657: Flags [P.], seq 6872:8044, ack 793, win 513, length 1172
21:20:13.186331 IP 70.24.37.40.58657 > 143.110.213.189.22: Flags [.], ack 8044, win 255, length 0
21:20:13.208093 IP 70.24.37.40.58657 > 143.110.213.189.22: Flags [P.], seq 793:829, ack 8044, win 255, length 36
21:20:13.208340 IP 143.110.213.189.22 > 70.24.37.40.58657: Flags [P.], seq 8044:8080, ack 829, win 513, length 36
21:20:13.239443 IP 70.24.37.40.58657 > 143.110.213.189.22: Flags [P.], seq 829:865, ack 8080, win 255, length 36
21:20:13.239610 IP 143.110.213.189.22 > 70.24.37.40.58657: Flags [P.], seq 8080:8116, ack 865, win 513, length 36
21:20:13.271386 IP 70.24.37.40.58657 > 143.110.213.189.22: Flags [P.], seq 865:901, ack 8116, win 255, length 36
21:20:13.271549 IP 143.110.213.189.22 > 70.24.37.40.58657: Flags [P.], seq 8116:8152, ack 901, win 513, length 36
21:20:13.284948 IP 143.110.213.189.22 > 70.24.37.40.58657: Flags [P.], seq 8152:8308, ack 901, win 513, length 156
21:20:13.285172 IP 143.110.213.189.22 > 70.24.37.40.58657: Flags [P.], seq 8308:9128, ack 901, win 513, length 820
21:20:13.290571 IP 70.24.37.40.58657 > 143.110.213.189.22: Flags [.], ack 9128, win 251, length 0
21:20:13.303016 IP 70.24.37.40.58657 > 143.110.213.189.22: Flags [P.], seq 901:937, ack 9128, win 251, length 36
21:20:13.303205 IP 143.110.213.189.22 > 70.24.37.40.58657: Flags [P.], seq 9128:9164, ack 937, win 513, length 36
21:20:13.339369 IP 70.24.37.40.58657 > 143.110.213.189.22: Flags [P.], seq 937:973, ack 9164, win 251, length 36
21:20:13.339579 IP 143.110.213.189.22 > 70.24.37.40.58657: Flags [P.], seq 9164:9200, ack 973, win 513, length 36
21:20:13.366338 IP 70.24.37.40.58657 > 143.110.213.189.22: Flags [P.], seq 973:1009, ack 9200, win 251, length 36
21:20:13.366498 IP 143.110.213.189.22 > 70.24.37.40.58657: Flags [P.], seq 9200:9236, ack 1009, win 513, length 36
21:20:13.388958 IP 143.110.213.189.22 > 70.24.37.40.58657: Flags [P.], seq 9236:10296, ack 1009, win 513, length 1060
21:20:13.394236 IP 70.24.37.40.58657 > 143.110.213.189.22: Flags [.], ack 10296, win 255, length 0
21:20:13.413858 IP 70.24.37.40.58657 > 143.110.213.189.22: Flags [P.], seq 1009:1045, ack 10296, win 255, length 36
21:20:13.414074 IP 143.110.213.189.22 > 70.24.37.40.58657: Flags [P.], seq 10296:10332, ack 1045, win 513, length 36
21:20:13.461102 IP 70.24.37.40.58657 > 143.110.213.189.22: Flags [.], ack 10332, win 255, length 0
21:20:13.461102 IP 70.24.37.40.58657 > 143.110.213.189.22: Flags [P.], seq 1045:1081, ack 10332, win 255, length 36
21:20:13.461331 IP 143.110.213.189.22 > 70.24.37.40.58657: Flags [P.], seq 10332:10368, ack 1081, win 513, length 36
^C
84 packets captured
96 packets received by filter
0 packets dropped by kernel